{
  "$schema": "http://json-schema.org/draft-07/schema#",
  "$id": "council-config.schema.json",
  "title": "CouncilConfig",
  "description": "Configuration for the henka-council governance layer (.council/config.json).",
  "type": "object",
  "required": ["council_version", "target_project", "autonomy_level", "review_frequency"],
  "properties": {
    "council_version": {
      "type": "string",
      "description": "Version of the henka-council plugin.",
      "pattern": "^[0-9]+\\.[0-9]+\\.[0-9]+$"
    },
    "target_project": {
      "type": "string",
      "description": "Name or path of the target project being governed."
    },
    "autonomy_level": {
      "type": "integer",
      "minimum": 0,
      "maximum": 5,
      "description": "Nominal autonomy level (0–5). Subject to dynamic floor (R10)."
    },
    "review_frequency": {
      "type": "string",
      "enum": ["every-sprint", "every-other-sprint", "manual"],
      "description": "How often the council convenes for review."
    },
    "cycle_length": {
      "type": "integer",
      "minimum": 1,
      "description": "Number of sprints per PDCA cycle. Default 5.",
      "default": 5
    },
    "dispatch_mode": {
      "type": "string",
      "enum": ["sequential", "parallel"],
      "description": "Agent dispatch mode. Sequential by default in v0.1.",
      "default": "sequential"
    },
    "andon_takt_seconds": {
      "type": "integer",
      "minimum": 60,
      "description": "Wall-clock timeout in seconds for andon alert swarm resolution. Default 600.",
      "default": 600
    },
    "dynamic_autonomy_thresholds": {
      "type": "object",
      "description": "Thresholds governing dynamic autonomy floor drops (R10).",
      "properties": {
        "consecutive_fail_count": {
          "type": "integer",
          "minimum": 1,
          "description": "Number of consecutive sprint FAILs before floor drops. Default 2.",
          "default": 2
        },
        "andon_stop_consecutive_count": {
          "type": "integer",
          "minimum": 1,
          "description": "Number of consecutive andon-stop events before floor drop. Default 3.",
          "default": 3
        },
        "andon_stop_distinct_originators_required": {
          "type": "integer",
          "minimum": 1,
          "description": "Distinct originator agents required for andon-stop floor drop trigger. Default 2.",
          "default": 2
        }
      }
    },
    "halt_conditions": {
      "type": "object",
      "description": "Conditions that trigger a halt in the autorun loop.",
      "properties": {
        "blocking_henkaten": {
          "type": "boolean",
          "default": true
        },
        "high_risk_henkaten": {
          "type": "boolean",
          "default": true
        },
        "max_consecutive_failures": {
          "type": "integer",
          "minimum": 1,
          "default": 3
        },
        "user_intervention_requested": {
          "type": "boolean",
          "default": true
        }
      }
    },
    "custom_henkaten_categories": {
      "type": "array",
      "description": "Project-specific custom sub-types beyond the built-in 13.",
      "items": {
        "type": "object",
        "required": ["category_id", "fourM_axis", "description"],
        "properties": {
          "category_id": {
            "type": "string",
            "description": "Unique identifier for this custom category."
          },
          "fourM_axis": {
            "type": "string",
            "enum": ["Man", "Machine", "Material", "Method"],
            "description": "Primary 4M axis for this custom category."
          },
          "description": {
            "type": "string"
          },
          "detection_signals": {
            "type": "array",
            "items": {"type": "string"}
          },
          "default_impact_level": {
            "type": "string",
            "enum": ["informational", "actionable", "blocking", "high-risk"]
          },
          "recommended_agents": {
            "type": "array",
            "items": {"type": "string"}
          }
        }
      }
    },
    "irreversible_overrides": {
      "type": "array",
      "description": "Commands moved out of the reversibility denylist with Level 5 ratification.",
      "items": {
        "type": "string"
      }
    }
  },
  "additionalProperties": false
}
