{
  "council_version": "0.1.0",
  "target_project": "trine-eval",
  "autonomy_level": 3,
  "review_frequency": "every-sprint",
  "cycle_length": 5,
  "dispatch_mode": "sequential",
  "andon_takt_seconds": 600,
  "dynamic_autonomy_thresholds": {
    "consecutive_fail_count": 2,
    "andon_stop_consecutive_count": 3,
    "andon_stop_distinct_originators_required": 2
  },
  "halt_conditions": {
    "blocking_henkaten": true,
    "high_risk_henkaten": true,
    "max_consecutive_failures": 3,
    "user_intervention_requested": true
  }
}
